id,img,label,text,img_exists
74825,img/74825.png,0,when your sister gives you some good information,True
24861,img/24861.png,1,her : he's probably thinking about other girls... him : how do blind people know when to stop wiping their ass?,True
43609,img/43609.png,0,this could be us right now but the fucking apocalypse got rescheduled again,True
69751,img/69751.png,1,"spiders be like black people.. not all of them are dangerous, but still, you don't want one in your house",True
95071,img/95071.png,0,introducing honky kong,True
94532,img/94532.png,1,see? i fuckin told you! a little foil on top keeps them jewsy,True
07412,img/07412.png,1,white trash nation,True
53679,img/53679.png,0,and that was the last time we let uncle larry babysit,True
94281,img/94281.png,0,when i try to fit in with other people,True
07935,img/07935.png,0,"''did you know princess diana had dandruff?'' ''oh yes, yes, they found her head and shoulders on the dashboard''",True
48307,img/48307.png,0,go home stoned eyes give nothing away,True
25837,img/25837.png,0,i used to provide therapy for those afflicted with aberrant behaviors! now instead those behaviors are celebrated!,True
05276,img/05276.png,0,talk about that for a team photo,True
14906,img/14906.png,0,"if you don't want to get raped, just say yes well boys we did it, rape is no more",True
51730,img/51730.png,0,for sale antique farm equipment,True
89275,img/89275.png,1,please give me more white nessa fanarts i can't cum to nigger,True
92308,img/92308.png,1,april 15 tax reminder don't forget to pay your taxes. 21 million illegal aliens are depending on you! muchas' gracias!,True
16948,img/16948.png,1,yes sir..! that's a cock,True
82635,img/82635.png,0,i am jealous of her she's so pretty,True
05164,img/05164.png,1,dark humor is like food not everyone gets it,True
54891,img/54891.png,1,"got kicked out of the hospital. apparently, the sign ""stroke patients here"" meant something completely different",True
92368,img/92368.png,0,american soldiers praying in jesus name that they don't have to go overseas for the holidays,True
39102,img/39102.png,0,we could destroy all of them but we let some of them survive so you know why we did it,True
56310,img/56310.png,0,"yes hello, maria? your uber has arrived",True
42983,img/42983.png,0,"i protested trump today mommy oo00h, who's my big boy",True
56213,img/56213.png,0,let me play with the chew toys,True
12036,img/12036.png,1,execute a plan to accept your actual born sex you'll be happier when you do,True
10395,img/10395.png,0,2+2 is potato minus 1 is poo quick math!,True
71325,img/71325.png,0,i dont lift so that doesnt make me sexy? wallet and pay for all the shit you want. i bet its sexy when i lift my wallet and pay for all the shit you want,True
31270,img/31270.png,0,"sometimes in life, we hang on tight to the wrong things",True
63124,img/63124.png,0,"""never forget"" -you said.. i am the proof you have forgotten",True
79146,img/79146.png,0,breaking: rep. ilhan omar broke federal tax law she filed her taxes jointly with a man to whom she was not legally married,True
94352,img/94352.png,1,whitesox ticket: $55 beer: $8 hot dog: $6 watching a muslim from kenya throw a 28 mph fastball like an 8 yr old little girl: priceless,True
65871,img/65871.png,0,a brown girl studying for example,True
42836,img/42836.png,1,dick so good it made my pussy retarded,True
02543,img/02543.png,0,catch me outside how bout dat i'll catch my damn self outside,True
35167,img/35167.png,0,it's peanutbutter jelly time!!!!,True
34695,img/34695.png,0,omg he's mad,True
71452,img/71452.png,0,when you find out the blood of children is the secret to everlasting life,True
23698,img/23698.png,0,family from mexico crossing border,True
13695,img/13695.png,1,when you let your ethiopian child sexslave swallow your cum i am a generous god,True
05832,img/05832.png,0,hitler giving a speech,True
41578,img/41578.png,0,do you know why i pulled you over? because you scored low on the asvab?,True
14379,img/14379.png,0,lizzie velasquez was born with a rare disease and is now a motivational speaker,True
53812,img/53812.png,1,"there's only one way you 'negotiate'with islam. you kill it with extreme prejudice.""",True
07438,img/07438.png,0,how women win an argument,True
30785,img/30785.png,0,my first act? getting rid of the smell he brought to the house,True
03841,img/03841.png,1,when i grow up... lol nevermind,True
68934,img/68934.png,0,relax... we're all crazy... it's not a competition,True
51094,img/51094.png,0,don't park to close to my truck boy!,True
82963,img/82963.png,1,if there are no blacks there would be no racism,True
91856,img/91856.png,0,ahmed i love you too,True
84192,img/84192.png,1,"""women, you have to treat them like shit."" - donald trump",True
15728,img/15728.png,1,this head diaper is proof indians have poo poo in their brains still not defamation,True
03675,img/03675.png,0,because of trump i got fired from my job,True
07561,img/07561.png,1,"ernie remembers the brave soldiers who fought before him. tonight, he would reenact their bold acts by smashing through his jewish neighbors glass window",True
09238,img/09238.png,0,turn that frown upside down,True
53917,img/53917.png,0,when your man a dog but yo monkey ass stay with him,True
82531,img/82531.png,0,help the needy worldwide!,True
03715,img/03715.png,0,great at making martinis terrible at stealing tambourines,True
71938,img/71938.png,0,goes on ancestry.com instead of match.com,True
91827,img/91827.png,0,two powerful women in our country,True
26803,img/26803.png,0,"oompa loompa doompeda dee! if you hit that, it will burn when you pee!",True
14620,img/14620.png,0,the look you give your friend when you know hes lyin,True
97058,img/97058.png,1,doctor: take this medicine after food african kid:,True
06479,img/06479.png,1,when you've finally become a cop and see a black guy this is where the fun begins,True
18532,img/18532.png,1,if i had a dollar for every racist thing i've said... some black motherfucker would probably rob me,True
53486,img/53486.png,1,when you nut in the arab girl and she has a normal orgasm you were supposed to explode!,True
13098,img/13098.png,1,upper downer,True
25986,img/25986.png,0,nothing more beautiful than ironed clothes,True
37059,img/37059.png,0,after goat herding mohammed is very tired,True
28154,img/28154.png,1,we can kill as many as we want and your stupid government keeps bringing us in,True
59026,img/59026.png,1,"after wwii, i said 'we defeated the wrong enemy.' now, you are bankrupt surrounded by perverts and enemies. was i right?!",True
56819,img/56819.png,1,all aboard the jew jew train,True
76104,img/76104.png,1,protect america from boatloads of refugees fleeing scandinavia's socialist tyranny,True
23761,img/23761.png,0,this lady is not amused,True
92078,img/92078.png,0,and that's how you load a magazine into the gun,True
29850,img/29850.png,0,crackers gonna crack,True
71082,img/71082.png,0,"why is it when your wife or girlfriend gets pregnant, all her friends rub he belly and say ""congratulations!"" but nobody rubs your dick and says ""good job"" """,True
26490,img/26490.png,0,cool tanks drive away from explosions without looking back,True
61395,img/61395.png,0,when you have to have more than one kind of broom to keep your place clean,True
95214,img/95214.png,0,"big bird's species were mostly scavengers but like the turkey vulture, they would attack weakened prey",True
72940,img/72940.png,1,lies that people say to themselves being human he thinks he's a equal rights they think they deserve normal they think they are,True
47196,img/47196.png,0,"musslamic democrat, ilhan omar, has threatened members of congress she's told several republicans that she'll send them ""shawarma"", to give them a taste of her culture"" share to say arrest her now!",True
72461,img/72461.png,0,this one time at camp we got so baked,True
50467,img/50467.png,1,ever hear something so stupid it gives you forest whitaker eye,True
65782,img/65782.png,0,these were the men protesting there right,True
67024,img/67024.png,0,shhh...the christians think this holiday is about jesus. wait until they discover it's traditionally celebrated with orgies!,True
73965,img/73965.png,0,just a man and his dog his dog companion,True
54138,img/54138.png,0,how hungry people eat their food mmmm.... delicious,True
82596,img/82596.png,0,i am ready to serve my first term,True
92457,img/92457.png,0,how you look when someone says something stupid,True
57426,img/57426.png,1,when you see muslims at bunnings buying pool chemicals and fertilizer,True
71635,img/71635.png,0,i don't need you to tell me how fuckin good my memes are... i get reported all the fuckin' time,True
47286,img/47286.png,0,hillary clinton against the death penalty. gallows are pure evil . anyone who still practices this form of execution is sick,True
52819,img/52819.png,1,you are so queer it could be raining titties and you would still get hit in the face with a dick,True
37465,img/37465.png,0,how black people became christians,True
49870,img/49870.png,0,love comes in all shapes and sizes,True
57386,img/57386.png,0,i have tits give me free stuff,True
89617,img/89617.png,0,horrifying photo from nuclear bomb,True
51802,img/51802.png,1,yo dawg i heard you loved chinese food so we killed your cat,True
41720,img/41720.png,1,you think im scared of saying nigger?,True
26735,img/26735.png,1,"you pick cotton to get to it because it's white, it works, and why don't black people like aspirin?",True
27058,img/27058.png,1,where's jaws when you need him ?,True
46138,img/46138.png,0,"they had us in the first half, not gonna lie honey, having a small dick is not a big deal i know it darling, but i'd prefer if you did not have any",True
93471,img/93471.png,0,when you haven't stolen for over 2 weeks.,True
75682,img/75682.png,1,"""the jew is the demon behind the corruption of mankind.""",True
46715,img/46715.png,0,good things come to those who wait,True
61093,img/61093.png,0,how the ancestors look at you when you stupid,True
24751,img/24751.png,0,i love pudding pudding my dick where it doesn't belong,True
41379,img/41379.png,0,how you look when youre black and you celebrate the 4th of july,True
46358,img/46358.png,1,with when you enter a mosque your weapon to collect some kills 71 yo afghan refugee: hello brother,True
04928,img/04928.png,1,dishwasher for sale missing parts,True
76953,img/76953.png,0,and if i keep my arms like this i look like a teapot,True
48926,img/48926.png,0,i bet they lived happily married,True
58304,img/58304.png,0,you took us to the wrong mountain bro,True
43905,img/43905.png,1,black on black,True
58071,img/58071.png,0,"""when a guy says ""i love you"", he really mean it but when a girl says ""i love you"", she just want to sleep with you & hurt your feeling.",True
51870,img/51870.png,0,"helen keller and her beloved cat, ""mittens""",True
93854,img/93854.png,1,i just realized we know we don't want him in the same bathroom with our wives,True
94783,img/94783.png,1,"hellen keller and her boston terrier ""phiz""",True
26140,img/26140.png,0,lebron james before he got his hairline fixed,True
04971,img/04971.png,0,happy birthday sugar tits,True
02654,img/02654.png,0,when people are spreading rumors but you're unbothered,True
24519,img/24519.png,0,marital status?? in a relationsheep.,True
31549,img/31549.png,1,the wife said we needed a new coffee maker so i got one. her name is jill. the wife was not amused..,True
97562,img/97562.png,1,just bought my first slow cooker,True
39107,img/39107.png,0,when you're shy everytime your friend takes selfies,True
40315,img/40315.png,0,my goal for 2018 is to accomplish the goals of 2017 which i should have done in 2016 because i promised them in 2014 and planned them in 2013,True
89612,img/89612.png,0,what's the difference between you and a pizza? a pizza taste better,True
05498,img/05498.png,0,step one: turn on the gas,True
50674,img/50674.png,0,that one time when joe biden kept his hands to himself,True
59864,img/59864.png,0,that's a nice turkey sandwich  it's ha'am!,True
62315,img/62315.png,0,i'm arresting you for public intoxication,True
08243,img/08243.png,0,damn i need some shades,True
60238,img/60238.png,1,dark humor is like good food not everyone deserve it ;,True
10269,img/10269.png,0,when your human stops petting you,True
19702,img/19702.png,0,i wish jew a happy brithday,True
75146,img/75146.png,0,handjobs sold separately,True
62471,img/62471.png,1,"pssst! the jews are the globalists that's what the term international jewry"" meant. but don't tell anyone, you can't say ""it's the jews""",True
43025,img/43025.png,1,that chicken was so black the police just arrested it,True
59327,img/59327.png,0,wanna go masturbate? fuck yeah! masturbating,True
95401,img/95401.png,0,meanwhile at the isis strip club,True
94580,img/94580.png,0,racing for pink slips in south africa,True
19258,img/19258.png,1,handjobs sold separately,True
47123,img/47123.png,0,good morning sleepyhead,True
46501,img/46501.png,1,muslims in 2001 defund homeland security! muslim in congress 2019,True
42163,img/42163.png,1,farm equipment and livestock don't mix,True
98624,img/98624.png,0,ma! the meatloaf!,True
59468,img/59468.png,0,chris brown and rihanna at an event,True
05926,img/05926.png,1,this sunday.. don't forget to set your bomb forward one hour,True
43652,img/43652.png,0,white people is this a shooting range?,True
07659,img/07659.png,0,latinos will do anything to get into trump's america,True
97463,img/97463.png,1,when you run over antifa protestors and you hear one being dragged,True
17853,img/17853.png,0,man of the year,True
38051,img/38051.png,1,when you slap your  dishwasher too hard,True
15820,img/15820.png,1,stop racism black children and white children are the same,True
61730,img/61730.png,1,oh look my new wife arrived,True
85167,img/85167.png,0,finding a bomb in a video game,True
56738,img/56738.png,0,i long for the days before politcal correctioness when kids were allowed to play livestock management technicians and indigenous people,True
76358,img/76358.png,1,"this is steve, he lives with both parents, who both work. no one in his family has a middle name in their facebook name, like javeon doingbigthings jackson. everyone in his family can swim",True
07893,img/07893.png,0,wax figure reconstruction of anne frank,True
04813,img/04813.png,1,when you haven't stolen for over 2 weeks.,True
85716,img/85716.png,1,when a retarded chick stares at you in lazy eye i'm gonna stick my dick in the mashed potatoes!,True
98731,img/98731.png,0,who farted ?,True
94083,img/94083.png,0,this is how lesbians have sex,True
96752,img/96752.png,0,chris rock gets his own netflix special in february 2018,True
31824,img/31824.png,0,i got my hair did,True
90742,img/90742.png,0,you gotta pump those numbers up those are rookie numbers,True
39148,img/39148.png,1,guys i think my dog has autism lmao,True
16054,img/16054.png,0,fuck goat right in the asshole,True
08743,img/08743.png,0,"if you see me in public looking a hot mess, just know; my bills are paid, my children have food, & i ain't trying to impress you",True
78365,img/78365.png,0,mein feelings have been hurt,True
01835,img/01835.png,0,that makes my lady junk tingle,True
24730,img/24730.png,0,feeling like a bad mom? quokkas toss their babies at predators so they can escape,True
41308,img/41308.png,1,how in the hell did we go from this.. to being afraid of offending muslims?!,True
23459,img/23459.png,0,i don't understand your specific kind of stupid but i do admire your total commitment to it,True
81304,img/81304.png,0,muslims goats,True
76923,img/76923.png,0,"""i inherited a mess!"" - donald trump no, you inherited a fortune. we elected a mess!",True
35604,img/35604.png,0,if you got your phone wet try leaving it in dry rice overnight. it will attract the water from the phone and fix your electronic for you,True
80735,img/80735.png,0,if there's no one to hold your hand put your hands in your pocket and continue,True
08146,img/08146.png,1,i am a gamer not because i don't have a life but because i hate women and minorities,True
42039,img/42039.png,0,japanese citizen watches as nuke drops on the 9th of august 1945 (colorized),True
74951,img/74951.png,0,volkswagen cars produce more gaz than expected ach!! thats my car,True
40597,img/40597.png,1,the difference between moderate muslim and radical muslim moderate muslim follow my allah or i kill you! radical muslim follow my allah or he kill you,True
82697,img/82697.png,1,when you catch your goat with another man ya done fucked up,True
21930,img/21930.png,0,hitler looking sad af,True
57209,img/57209.png,0,he went to jail for your sins,True
61725,img/61725.png,1,transgender female athlete biological female,True
08254,img/08254.png,0,we've been saved! from what? critical thinking?,True
75234,img/75234.png,1,she called me islamphobe so i gave her some sharia law!,True
08241,img/08241.png,0,when people are still talking about epstein's pedo ring after 3 mass shootings in a week you're going to need a bigger,True
21890,img/21890.png,0,transgenderman (fallonfox) brutally beats black woman in ufc match,True
03248,img/03248.png,0,when you just can't stop thinking about obama,True
14083,img/14083.png,1,racing for pink slips in south africa,True
30961,img/30961.png,1,i see!,True
82540,img/82540.png,1,nobody: european jews after 1933: now we're the skeleton crew,True
49527,img/49527.png,0,when each letter is awesome,True
45286,img/45286.png,0,"i would love to be excited about the women's soccer team's victory. but, this guy ruined it for me",True
31408,img/31408.png,0,meanwhile at the isis strip club,True
45829,img/45829.png,0,i made it out alive the democrats didn't get me,True
29104,img/29104.png,0,america is for americans period! i agree. why don't you go back to europe?,True
02967,img/02967.png,1,when the black kids start fighting at school,True
34520,img/34520.png,0,i'm just not happy being with you falcon punch!,True
43680,img/43680.png,0,if security is this important at our airports... ...shouldn't it be this important at our borders too?,True
61532,img/61532.png,0,claims to be pro-life dies,True
14958,img/14958.png,1,i got kicked out of hogwarts for using black magic,True
49385,img/49385.png,1,this is not the middle-east where america is hated and muslim terrorist are born this is michigan,True
53720,img/53720.png,0,forcing children into religion is child abuse. religion has to be taught. it's not natural ,True
59436,img/59436.png,1,jewber: uber for jews,True
98427,img/98427.png,0,flash drive butt plug for when you really want to back that ass up,True
56789,img/56789.png,0,these are gangsters these are wankers,True
91675,img/91675.png,0,stop saying we are terrorists muslims are not terrorists,True
73256,img/73256.png,1,im mixed with what? gorilla and rhino,True
89165,img/89165.png,1,what if i change my gender so i become the victim and not the rapist,True
25013,img/25013.png,1,when the school shooter finally leaves and the hottest girl in class is laying dead on the floor it's free real estate,True
36590,img/36590.png,1,this offends me ban them do you agree?,True
28964,img/28964.png,1,"just got his euthanasia forms signed, retard can't even read so i told him he got accepted into harvard lmfao",True
86125,img/86125.png,1,when you insult a liberal intentionally,True
70561,img/70561.png,1,"fuck off!! you muslim bastards, we didn't win 2 wars just to hand england over to you!!!",True
58361,img/58361.png,1,there are only two genders: male female,True
57093,img/57093.png,1,when she asks to move in but you already own a dishwasher,True
96735,img/96735.png,0,i sexually identify as thomas the tank engine,True
50239,img/50239.png,1,"everywhere: eats out africa: ""we don't do that here""",True
28450,img/28450.png,0,it was at this moment jacob knew he fucked up,True
43815,img/43815.png,0,if theres even one homeless child in america we have no room for illegal aliens,True
35670,img/35670.png,0,if this terrorizes you and this doesn't something is very wrong with you,True
53817,img/53817.png,0,game of the year 1817,True
36178,img/36178.png,0,you knew that was the wrong purse... are you serious!,True
60249,img/60249.png,0,when nazi germany would have won ww2 would there be a burger named mchitler?,True
02914,img/02914.png,0,the only thing that hinders you is your own motivation,True
24630,img/24630.png,0,did you hear that ? smells right ? lmao,True
15349,img/15349.png,1,"whenever you feel stupid, remember this",True
38965,img/38965.png,0,documentary on the kkk premiers wednesday on fox,True
47192,img/47192.png,0,the flag flies high and proud,True
36972,img/36972.png,0,need a job? the democrat party is hiring no experience or intelligence required,True
65743,img/65743.png,1,mommy look! an indian man! don't look at them ricky. i don't want you to be influenced by...ohgodno rickyyy show bobs and vagene pls,True
81603,img/81603.png,1,what's the deal with black people they're not black and they're not people,True
62843,img/62843.png,0,when u stop being shy around new people but u start getting annoying why are you like this,True
16579,img/16579.png,0,when your finally starting to be accepted for who you are,True
94150,img/94150.png,0,america be like never forget get over it,True
79803,img/79803.png,0,when did you have lunch?,True
02735,img/02735.png,0,when each letter is a mental disorder,True
80123,img/80123.png,0,every man needs a decent coffee maker,True
70845,img/70845.png,1,slavery reinstated catch yourself a strong one,True
50931,img/50931.png,0,never had one before. what? a room to yourself? yes,True
57183,img/57183.png,0,if you're a man and put your hands on a woman then you aren't a man,True
70264,img/70264.png,1,great at making martinis terrible at stealing tambourines,True
50328,img/50328.png,0,los angeles has ice cube new york has nas detroit has eminem your city has ?,True
53291,img/53291.png,0,"sure she's cute, but my car's still dirty.",True
60758,img/60758.png,0,thankfully youtube blocked those videos to show their support for muslim people,True
16084,img/16084.png,1,"do you smell that? no me neither, start cooking",True
71483,img/71483.png,0,"i was told to make a fb pregnancy pic. wife was not amused. ""there are no mistakes, just happy little accidents""",True
50918,img/50918.png,0,paraplegic woman in a wheelchair with her coach,True
40576,img/40576.png,0,i don't pretend to be something i'm not except sober. i've pretended to be sober a few times,True
51948,img/51948.png,0,the leader of north korea during a meeting,True
92708,img/92708.png,0,the book about terrorism,True
37601,img/37601.png,0,my favorite sex position is the challenger i go hard for 73 seconds then prematurley blow,True
12534,img/12534.png,0,border agents in texas aprehend over 400 span. in just 5- minutes illegals we know we have an issue with illegal immigration but how can we fix this and not separate families,True
83216,img/83216.png,0,you know it's going a be a serious blow job when he puts his hair up in a manbun,True
91348,img/91348.png,0,yo dawg you gotta chill,True
75041,img/75041.png,0,"to all my friends who post controversial, obscene, dirty, offensive, derogatory posts... keep that shit up. i like it",True
69234,img/69234.png,1,do i need to dig up hitler to show you how to use an oven,True
85472,img/85472.png,0,once we are done destroying our country we'll move to yours!,True
09462,img/09462.png,0,halloween got you like,True
16437,img/16437.png,0,unnecessary life-vest ice cubes float,True
93841,img/93841.png,1,"you need to quit messing with those white devils, brotha!!",True
13842,img/13842.png,0,"...and down here, we'll add a happy little van, down by the river",True
75421,img/75421.png,1,mfw the local tranny gets lynched,True
19304,img/19304.png,0,dark humor is like good food not everyone deserve it,True
14859,img/14859.png,0,when your lipstick smudges after eating a hamburger,True
80652,img/80652.png,0,how to remember kid in hot car keep 2nd road beer with them,True
31728,img/31728.png,0,"either we fuckin, or i'm fuckin",True
73180,img/73180.png,0,"the first time i got high was in the backseat of my older brother's car. it must have been some good shit too, because i am an only child",True
43581,img/43581.png,0,when you found your wife is cheating on you,True
97201,img/97201.png,1,"never let anyone tell you what you can or cannot do. just look at beethoven. everyone told him he would never be a musician, just because he was deaf but did he listen?",True
97438,img/97438.png,0,buchenwald concentration camp bones of anti-nazi german women still are in the brick ovens on the crematorium,True
63520,img/63520.png,1,when black people make white jokes when white people make black jokes,True
50614,img/50614.png,0,clint eastwood and a monkey,True
97128,img/97128.png,1,know why colored people have all those air freshener in their cars? they can't stand the smell of ni**er either!,True
54263,img/54263.png,0,we're glad you're home,True
56134,img/56134.png,0,meanwhile at the isis strip club,True
97301,img/97301.png,0,will you hurry up and hunt some food we have to feed this starving child,True
92154,img/92154.png,1,what kind of punch can take out 20 kids and 6 adults? a sandy hook,True
46918,img/46918.png,0,muslims in 2001 muslim in congress 2019 defund homeland security!,True
03874,img/03874.png,1,one of the poor defenseless refugees we hear about she's smuggling 31 pounds of pure heroin,True
90251,img/90251.png,0,when you remebered where you left your keys,True
79325,img/79325.png,0,"you can cry about ""islamophobia"" all you want ! we don't give a rats ass about allah ~arv~ we the people of america stand with israel",True
70835,img/70835.png,1,when u forget to lock ur basement door and ur pets try to run away,True
91853,img/91853.png,1,kick islam out of india,True
36541,img/36541.png,1,bruhh.. white ppl give me a headache,True
36190,img/36190.png,0,immigrants illegal aliens,True
