id,img,label,text,img_exists
42953,img/42953.png,0,its their character not their color that matters,True
23058,img/23058.png,0,don't be afraid to love again everyone is not like your ex,True
13894,img/13894.png,0,putting bows on your pet,True
82403,img/82403.png,0,"everybody loves chocolate chip cookies, even hitler",True
76932,img/76932.png,0,fine you're right. now can we fucking drop it?,True
02973,img/02973.png,0,how long can i run? till the chain tightens,True
58306,img/58306.png,0,"what is he hiding? we need to see his tax returns! let me stop you right there hillary you deleted 30,000 emails, used bleach bit on hard drives, then destroyed phones with hammers you have no right to talk about people hiding anything truth uncensored",True
79351,img/79351.png,1,jew mad? get fuhrerious!,True
34096,img/34096.png,0,"removes polish with chemicals, nobody bats an eye",True
25489,img/25489.png,1,brother... a day without a blast is a day wasted,True
79346,img/79346.png,0,voting for hillary is like letting casey anthony watch your kids because she's not guilty,True
97628,img/97628.png,0,"is it ok for your son or daughter to call another man ""daddy?",True
59784,img/59784.png,0,if people reject me because i stand on the truth then i have no problem walking alone,True
02146,img/02146.png,0,from the bottom of my heart i would like to sincerely apologize..... for being white,True
49752,img/49752.png,0,here's to all my friends who never post about politics or religion,True
25610,img/25610.png,0,enjoying a day at the beach,True
17956,img/17956.png,0,one simple question why are we letting one man systematically destroy our nation before our eyes? answer mitch mcconnell,True
10743,img/10743.png,0,move to new york they said it'll be fun they said,True
76825,img/76825.png,0,two woman walking home together after a nice day out together,True
72598,img/72598.png,0,texas churches be like... pew pew pew,True
43078,img/43078.png,0,i don't always have a heat stroke and get frostbite in the same week but when i do i know i'm in kentucky,True
06418,img/06418.png,0,1 bomb every minute,True
53976,img/53976.png,0,black power comes with a lot of responsibility,True
04876,img/04876.png,0,goin,True
86354,img/86354.png,0,officer down,True
52610,img/52610.png,1,i'm sick of politics so here's a pic of michelle obama riding a unicorn,True
58371,img/58371.png,0,when you suck at photoshop,True
27401,img/27401.png,0,for the last time.. i'm not michelle obama,True
89574,img/89574.png,0,i'm cute,True
25473,img/25473.png,0,and then i told them you're going on a fun camping trip,True
47913,img/47913.png,0,"the jussie smollett case explained. ""how do you plead? "" ""innocent!!!"" ""black, gay, trump hater, friend of michelle obama",True
08295,img/08295.png,0,please consider donating water to children in need,True
02497,img/02497.png,0,you're a wizard motherfucker,True
69357,img/69357.png,0,hey look at me! i'm a serial pedofile,True
54602,img/54602.png,1,when you just finished shooting a bunch of black kids but accidently killed a squirrel,True
63182,img/63182.png,0,my wife just got a seashell tattoo on her inner thigh if you put your ear to it you can smell the ocean,True
20619,img/20619.png,1,when you beat the shit out of the tranny hooker after you nut and call it a f****t but it doesn't get back up,True
82457,img/82457.png,0,ring ring hello? i've been waiting for your call all damn day!!!,True
81059,img/81059.png,0,i like my refugees like this '' '' '',True
40832,img/40832.png,0,taking photo with a mosque,True
05762,img/05762.png,0,"listen bitch, before you start fucking with me you should know my team is bigger",True
40259,img/40259.png,0,masturbation it's not just for men,True
85072,img/85072.png,0,what is this sleep of which you speak?,True
29163,img/29163.png,1,what kind of punch can take out 20 kids and 6 adults? a sandy hook,True
90583,img/90583.png,1,we can kill as many as we want and your stupid government keeps bringing us in,True
34961,img/34961.png,0,this cat is pushing a watermelon out of a lake. your argument is invalid,True
89762,img/89762.png,0,that blackened chicken was so dry it reminded me of your mother,True
75321,img/75321.png,1,cannibal tribe from indonesia will take muslim refugess in any amount,True
18350,img/18350.png,0,when you see the gas bill,True
30247,img/30247.png,0,broken chair,True
51243,img/51243.png,0,honestly how often do you masturbate?,True
01845,img/01845.png,0,when you consume too much trans fat,True
34791,img/34791.png,1,when i was a boy we didn't have things like adhd. it was called being a little bastard,True
41385,img/41385.png,0,y'all kids claims to be victims of slavery when we were the ones who lived it,True
34508,img/34508.png,1,jews are the problem. not just zionists or israelis. jews. all of them,True
80521,img/80521.png,0,him: the dishwasher is acting weird her: what's it doing? him: chopping fucking vegetables,True
93072,img/93072.png,1,"black people black people ""why would white america do this?""",True
96578,img/96578.png,1,mohammad is fucked by blink hacker group! oink oink! hi! my name's mohammad! fuck you muslims!,True
05249,img/05249.png,0,i am still so confused about the strategies in this game,True
20568,img/20568.png,0,meanwhile at the isis strip club,True
84269,img/84269.png,1,just ordered the new anne frank puzzle,True
41537,img/41537.png,1,i'm not transphobic i just think trans people shouldn't exist,True
54102,img/54102.png,1,i'm uncertain where i stand on abortion i like the killing babies but hate the idea of giving women a choice,True
03271,img/03271.png,0,when your wife and girlfriend dont get along,True
35264,img/35264.png,0,i like your cologne what is that? tricare? deers,True
14052,img/14052.png,0,this is racist but this is not?????,True
81064,img/81064.png,0,"your tits... in my hands, put them you will",True
36152,img/36152.png,0,"when your eating out your grandma and you taste horse cum then think to yourself ""oh that's how she died",True
80256,img/80256.png,0,damn girl that's a policy i could get behind,True
27398,img/27398.png,0,"if you believe that, i've got a virgin goat to sell you!",True
18730,img/18730.png,0,immigration invasion learn the difference,True
24631,img/24631.png,1,it's ma'am!! yooouu lookah like a man,True
23748,img/23748.png,0,bigbird singing to child on seasame street,True
63492,img/63492.png,0,making america white again,True
71436,img/71436.png,0,trump supporters be like mexicans stole my teeth,True
03258,img/03258.png,1,"i heard we can get free steroids in australia please help feed and house this poor, defenceless refugee. don't be racist and let me in!",True
20736,img/20736.png,1,go be gay somewhere else,True
06431,img/06431.png,0,when the employee asks what bra size you wear,True
34901,img/34901.png,1,gays aids it really be like that,True
28793,img/28793.png,0,congratulations it's non binary,True
05172,img/05172.png,1,islam is the religion of peace! if you don't agree i kill you!,True
96231,img/96231.png,0,when you're a convicted rapist but reruns of your show are still on tv because it's not like you tweeted something,True
81673,img/81673.png,0,when they don't get the memo that they lost the war,True
06873,img/06873.png,1,just got a bootleg copy of muslim porn deep goat,True
08523,img/08523.png,1,cute getting ready to start kid her life too bad shes already fkn' dead raped and murdered by an illegal immigrant,True
93260,img/93260.png,0,when she smiles at you from a distance,True
80269,img/80269.png,0,this is really out of mein kampfert zone,True
05712,img/05712.png,0,god will forgive you no matter what you've done sweet,True
72941,img/72941.png,0,hey liberals & democrats have you forgotten,True
21853,img/21853.png,0,pure american muscle,True
90146,img/90146.png,0,all races are equal,True
51278,img/51278.png,0,when you haven't stolen anything in a week,True
63095,img/63095.png,0,when you have errands to run but you're too tired to deal,True
37259,img/37259.png,0,loyalty always has a cost some times it pays off... ...and some times you take a loss,True
48106,img/48106.png,1,fuck islam,True
24368,img/24368.png,0,ignorance and hate will lead you to nothing but shame,True
96785,img/96785.png,0,lost african tribe,True
40567,img/40567.png,0,anne frank writing in her diary,True
38625,img/38625.png,1,"a german ss soldier punishing a small jewish boy by sticking a sharpened spear in the boys anus, auschwitz concentration camp, poland 1944. (colorized)",True
93826,img/93826.png,0,"my wife asked me where i'd like to be buried apparently, ""balls deep in your sister"" wasn't the answer she was expecting",True
92874,img/92874.png,0,so..convert to islam or die?  i say fuck it..let's roll,True
27946,img/27946.png,1,cadbury's halal creme eggs  now available in special edition,True
93614,img/93614.png,0,"i'm sorry i left the seat up, it won't happen again",True
02691,img/02691.png,0,teaching them how to hunt young,True
30452,img/30452.png,0,trump supporters be like show me where he lied,True
86491,img/86491.png,0,you are not wanted! you are a mental deficient!,True
04683,img/04683.png,0,"when you make a meme using a different language that everyone can still understand: no es mucho, pero es trabajo honesto",True
08593,img/08593.png,1,18 years later,True
92608,img/92608.png,0,says he alone is tough enough to defeat isis still too chickenshit to release his tax returns,True
61453,img/61453.png,0,when you find the cake your mum was hiding from you,True
39601,img/39601.png,0,welcome refugees to poland's newest 5 star hotel,True
12035,img/12035.png,0,i date crazy bikers with beards cause once you ride a beard and a harley you don't go back,True
80247,img/80247.png,0,the pimp hand strong enough for man but made for teaching,True
52890,img/52890.png,0,wait this isn't my dog,True
02485,img/02485.png,0,real friendship is sending them a link to something terrible so you can both be traumatised at the same time i torture all my friends. it's how i show love,True
13857,img/13857.png,0,this is why we shoot you guys,True
70942,img/70942.png,1,"lesbians should not be allowed to buy dildos you made your choice bitch, now live with it!",True
35102,img/35102.png,0,please be patient... we creating a better fuckup for all,True
36081,img/36081.png,0,in this edition we don't buy property; we steal it!,True
49083,img/49083.png,0,when you catch your goat with another man ya done fucked up,True
45938,img/45938.png,1,"hey, i just met you, and this is crazy, this is my grenade so blow me, maybe?",True
24309,img/24309.png,0,when people ask me who my favorite golden girl is,True
70925,img/70925.png,1,where did jimmy go during the bombing? everywhere,True
61278,img/61278.png,0,in a wolrd full of these people be this person,True
81675,img/81675.png,0,when your boss asks for the report but you went out the past few nights,True
85704,img/85704.png,0,how people look at me when i tell em i don't have kids,True
83570,img/83570.png,0,the loudest one in the room.. is the weakest one in the room,True
07968,img/07968.png,1,ernie mocks tyrone's lack of a father in front of the whole class,True
81259,img/81259.png,1,when you see a child in a gay parade half naked twerking with everyone celebrating ernie prepares to commit a hate crime,True
61480,img/61480.png,1,why is it bad to be a black jew because you have to sit at the back of the oven,True
35861,img/35861.png,0,banner in the streets hulk in the sheets,True
92741,img/92741.png,0,"wait, mohammad come back!! i didn't mean to laugh, really size doesh't matter to me lol",True
47326,img/47326.png,0,we are soldiers and we fight for our countries to our last minutes,True
86594,img/86594.png,0,wait for it .. ,True
63581,img/63581.png,1,wants you to accept him for being a girl couldn't accept himself at birth,True
17832,img/17832.png,0,it's time we make peace with islam,True
61578,img/61578.png,0,still smiles even when they are scared,True
17659,img/17659.png,0,ex girfriends be like.. i don't even care what he does anymore!!!,True
17205,img/17205.png,1,i win again! parkinson's center,True
15649,img/15649.png,0,be kind to those less fortunate than you,True
60329,img/60329.png,0,we swore we'd never forget 911,True
58276,img/58276.png,0,i may be blind but at least i'm rich!,True
38041,img/38041.png,0,justin trudeau the imam of canada,True
40897,img/40897.png,0,"with sensitive ass people, my sense of humor is way too fucked up for that",True
61780,img/61780.png,1,you may be a racist if.. your response to a question from an african american is to mention the inner city 25 times,True
75432,img/75432.png,0,greetings ... time to run,True
81706,img/81706.png,0,when you have to fight captain america because you had an argument,True
20971,img/20971.png,0,if i can't trust you i don't need you,True
70936,img/70936.png,0,everybody having kids /getting engaged and i'm over here like,True
04278,img/04278.png,0,never let someone who has done nothing tell you how to do anything,True
67485,img/67485.png,0,i'm going to prison aren't i ?,True
61234,img/61234.png,0,i could have annihilated all of them but i left some of them alive so you will know why i was killing them,True
49630,img/49630.png,0,if they aren't meant to cook why do they have eggs and milk inside them,True
60173,img/60173.png,1,"white people dont shoot eachother in the streets like black people do we do it in schools, because we have class",True
38490,img/38490.png,0,"""people are tired of the same, old ideas"" says the 74 year old socialist",True
76258,img/76258.png,0,when you advocate for killing babies after their birth and then you have ash on your forhead for ash wednesday unbelievable smh,True
08654,img/08654.png,1,never had one before . what? a room to yourself? a white bitch,True
37402,img/37402.png,0,when your stoner friend looks in your fridge,True
60317,img/60317.png,0,when your goat hits your g-spot,True
34805,img/34805.png,0,when you're trying to be a good student and just learn magic but three kids in class keep getting in trouble all the time,True
01389,img/01389.png,0,confession-every sunday around brunch time i take my cat to the mall and make people take pictures of us,True
75340,img/75340.png,1,"forgive me allah.. i just can't understand why i am allowed to behead my enemies and marry little girls, but i can't eat a fucking ham sandwich",True
96153,img/96153.png,0,jokes don't kill people they kill people,True
63917,img/63917.png,0,if he's marrying me then why's he fucking a goat,True
79054,img/79054.png,0,that face you make when you get asked a question and have to think on it for a while,True
07698,img/07698.png,0,"go ahead, call the cops see who cums first",True
01896,img/01896.png,0,terrorism is just part and parcel of living in a big city. sadiq khan london mayor tokyo: over 13 million people no islamic terrorism,True
80237,img/80237.png,0,when nobody knew who you were until you got on your knees,True
71045,img/71045.png,0,cutest little beagle in the whole wide world,True
67084,img/67084.png,0,creeps into your childs room empties his sack,True
68507,img/68507.png,1,black chicks even the white ones are ugly,True
26043,img/26043.png,0,love is love is love is love,True
26031,img/26031.png,0,muslims in a predominantly christian nation christians in a predominantly muslim nation,True
64701,img/64701.png,0,"well judge, made me do it all remember it was me who first said was kenyan",True
26495,img/26495.png,1,when your goat tells you she ain't on the pil,True
50273,img/50273.png,0,"""where did you learn to make kool-aid like that britney?""",True
46058,img/46058.png,1,when you beat up a black kid and get arrested for propriety damage,True
06218,img/06218.png,0,thats a little savage,True
02849,img/02849.png,1,abba ree i can fryyy,True
69042,img/69042.png,0,"did i just hear grandma tell me ""no""",True
27943,img/27943.png,0,batman! thank god you've arrived!,True
68159,img/68159.png,0,learning to ride a bike,True
91704,img/91704.png,1,when you finger a girl from auschwitz,True
63285,img/63285.png,0,"he's like 20 and still plays video games bitch please, yall 15 and pregnant",True
20751,img/20751.png,1,"""islam is love!"" ariana grande august 2017 hillary clinton rally yeah, if you're a goat ***",True
94351,img/94351.png,1,hmmm minyoda i am beat women i must,True
27489,img/27489.png,1,how do we destroy the patriarchy? it's simple. we eat it,True
71906,img/71906.png,0,when you feel beautiful no matter what the haters say,True
81265,img/81265.png,0,you'd be angry too if you found out they cancelled your favorite show,True
67384,img/67384.png,1,what's hillary's favorite pizza? little seizures,True
70549,img/70549.png,0,the old lady shows arthur what she used to do during the war,True
48612,img/48612.png,0,that's where the new skyscraper is going to come up,True
16380,img/16380.png,0,felling cute might fuck a goat later. idk,True
59478,img/59478.png,1,his grandparents died in the holocaust so we gonna put an oven in the trunk,True
93216,img/93216.png,0,when you have flashbacks from wwii,True
38127,img/38127.png,0,how the co looks when he tells the crew were not getting mail on the next ras,True
53962,img/53962.png,0,i support americans even though some of them are really hating on me right now,True
76213,img/76213.png,0,dark humor is like him '' it never gets old,True
04651,img/04651.png,0,what every muslim looks like to me,True
78560,img/78560.png,0,"""so first of all you guys didn't even invite me to your little airport fight and you guys know how much i love fighting so fuck you""",True
95317,img/95317.png,1,all those in favour of bringing swedish women to america as refugees instead of muslims please like and share,True
16490,img/16490.png,1,i said glass of juice not gas the jews,True
56389,img/56389.png,1,no means no unless she's dyslexic then it's on,True
74038,img/74038.png,0,when it comes to acting scarlett johansson has amazing tits,True
86530,img/86530.png,0,influence elections? haha that's a hoax,True
92450,img/92450.png,0,to bad i don't speak peasant .!,True
94721,img/94721.png,0,never forget the holocaust,True
54276,img/54276.png,0,fuck i stepped in shit,True
87049,img/87049.png,0,pauline hanson warns: obey our our rules our rules or go back where you came from!,True
54761,img/54761.png,0,"the answer to the age-old question, does a bear shit in the woods? answer... yes they do! and here is scientific proof",True
91375,img/91375.png,0,bank took your house? that must be tough,True
05129,img/05129.png,0,"you ever get laid in a sleeping bag? it's awful. you can't even move, you're drenched in sweat, and your scout master is covering your mouth",True
86054,img/86054.png,0,friendly reminder: a hooker and con man are in the white house fucking things up,True
29517,img/29517.png,0,they told me i could become anything so i became a scarecrow,True
72531,img/72531.png,1,indians evolution after 15august1947,True
27953,img/27953.png,1,i was chatting this liberal chick in a bar who told me that i should be more open to muslim culture so i raped her,True
07249,img/07249.png,0,obama throws first pitch at an all-star game,True
30948,img/30948.png,0,how it feels to chew peppermint gum after biting a jalapeno,True
38245,img/38245.png,0,when you eat your rehab romance booty in the laundry room but she's day 3 sick,True
89160,img/89160.png,0,live your life every moment,True
93658,img/93658.png,0,i like offending people because i think people who get offended should be offended,True
32046,img/32046.png,0,smoke pours from the wtc on 911,True
04568,img/04568.png,0,me during no shave november,True
92185,img/92185.png,0,running tired of bitches from the dick? i give you the clamp that bitch down 3000,True
75481,img/75481.png,0,this has nothing to do with this post but i have 2 barely fucked goats for sale,True
28971,img/28971.png,0,it wasn't my fault my truck has tranny issue's,True
26741,img/26741.png,0,on behalf of nsw go f@#k yourself queensland,True
14695,img/14695.png,1,my dad is the best at hide and seek he's been gone for 15 years,True
67219,img/67219.png,0,that's right white crackers,True
14697,img/14697.png,0,"everyone knows hitting appliances that stop working, sometimes fixes the problem",True
32468,img/32468.png,0,be sure to spay or neuter your spouse today,True
60937,img/60937.png,0,mississippi wind chime,True
65320,img/65320.png,1,what's the difference between a cow and the holocaust? you can't milk a cow for 75 years,True
04326,img/04326.png,1,when the chow mein was on point but you kinda miss your cat,True
52986,img/52986.png,1,the most beautiful chimpanzee and above him is one uglyass retarded nibba who says dc is better than marvel,True
63140,img/63140.png,0,and then i said homosexuals can go to heaven,True
68307,img/68307.png,0,just like that democrats who said you aren't mature enough to own a gun til 21 decided you are mature enough to vote on laws about guns at 16,True
75182,img/75182.png,0,what bomb,True
69137,img/69137.png,0,new seat belt design 50% less accidents,True
17829,img/17829.png,0,when you tell him he can't go to chic-fil-a on sundays. what do you mean?,True
32485,img/32485.png,0,when you floor it but your passengers arent ready,True
04296,img/04296.png,0,now imagine if native american cowboys rode bicycles,True
56841,img/56841.png,0,not all of us are terrorists but all terrorists are one of us,True
01658,img/01658.png,0,first rule of fight club.,True
85062,img/85062.png,1,who let this retard in this group,True
89740,img/89740.png,1,africa 100 years ago africa today + aids,True
53278,img/53278.png,0,*laughs in goat-fucker*,True
85271,img/85271.png,0,a bad day for everyone including muslims defend homeland security a good day for us all in 2019,True
16409,img/16409.png,0,hachimaki is a traditional headband worn by japanese men,True
17504,img/17504.png,0,beach vibe,True
62739,img/62739.png,0,lmao laugh my ass off,True
61802,img/61802.png,1,black friday sale,True
96143,img/96143.png,1,"roses are red, violets are blue mexicans are rapists, and so am i",True
51734,img/51734.png,1,when you're shooting up the school and the cops shoot the black kid that's running away,True
80534,img/80534.png,1,they trained you to hate the only man with the balls to stand up to them,True
61485,img/61485.png,0,"don't do the crime, if you can't do the time",True
89603,img/89603.png,0,when you've had a long day but you need to but geroceries,True
16784,img/16784.png,0,"o yeah we got the nintendo switch! hey goat, yes human? close your eyes goat, ok human",True
80169,img/80169.png,1,(muslim noises),True
54936,img/54936.png,0,summers here lets swim,True
15743,img/15743.png,0,when you introduce someone to a new meme you like that?,True
85362,img/85362.png,0,man getting arrested by the la pd,True
25968,img/25968.png,0,what! no i am not asian,True
41568,img/41568.png,1,when she hits you with the super sloppy 2 handed mctwist while making eye contact and calling you daddy and you just go full autistic,True
60128,img/60128.png,1,don't know how to deal with black people but i guess i'll take a shot at it,True
04325,img/04325.png,0,its a 3-day weekend pace yourself,True
07258,img/07258.png,0,"some crazy rez girls be like: ""if you ever leave me, i'll punch myself in the face and tell cops you did it""",True
06357,img/06357.png,0,it's time to stop this,True
68947,img/68947.png,0,fuck the enemy so hard their eyebrows bleed,True
25639,img/25639.png,1,why isn't my drain working? probably cause the pipe's black,True
52738,img/52738.png,0,all part of satan's plan. the anti christ will come from this,True
09716,img/09716.png,0,weeeee! im back home,True
08632,img/08632.png,1,"""why do you have to punch a hole in the wall when you get upset?"" white guys: it defines who i am",True
38427,img/38427.png,1,when you see another black person getting their ass whipped by the cops stop breaking the law,True
38156,img/38156.png,0,"we used to have safe neighborhoods now we have ""diversity""",True
62358,img/62358.png,0,when you enter the womens restroom by mistake,True
48317,img/48317.png,0,dressed for sundays best,True
76328,img/76328.png,0,broken dishwasher for sale or rent,True
84120,img/84120.png,0,when u tryin to be cute but she gotta make everything sexual,True
41032,img/41032.png,0,going on vacation vs going back to work,True
85923,img/85923.png,0,ford owner blew a rod wasnt talking about his engine,True
45912,img/45912.png,0,this offends me ban them do you agree?,True
06483,img/06483.png,1,"one day, long, long ago, there lived a woman who did not whine, nag or bitch. but it was a long time ago, and it was just one day. ~the end~",True
31074,img/31074.png,0,that job interview was going so well. until i realized i was fucked up on acid in the middle of a cornfield naked and talking to a scarecrow,True
82637,img/82637.png,0,"""where you can get with that bull shit what is "" fuck outta here"" correct",True
29761,img/29761.png,0,ps4 playstation' vr required food simulator 18 18,True
12867,img/12867.png,1,"part of america, ""muslims have always been starting in colonial times"" and they were hijackers and terrorists back then too you f'n jackass",True
26497,img/26497.png,0,people will do shit like this but lock their door when someone sketchy walk by,True
27139,img/27139.png,0,new military drone to fight isis it explodes on penatration,True
64853,img/64853.png,0,the black ranger do you really think they were just talking about his costume? your argument it's completely valid!,True
18597,img/18597.png,0,they stole ma chickin i stole their life,True
58604,img/58604.png,1,i got 99 problems and chromosomes are one,True
16278,img/16278.png,1,"i played baseball with a bunch of orphans yesterday. i won, because none of them knew where home was",True
40932,img/40932.png,0,"when someone accuses you of being racist, but they don't realize you have a black friend i know someone",True
92453,img/92453.png,0,when your boss volunteers you for the next suicide bombing,True
