id,img,label,text,img_exists
45180,img/45180.png,0,"rep omar accuses trump of being 'bigoted' toward lgbt... do you agree with her, or is she out of her mind?",True
78564,img/78564.png,1,"when you take your dishwasher to the restaurant, but it starts talking",True
71340,img/71340.png,0,slaves got whipped back in the day,True
56107,img/56107.png,0,a kind women giving a starving child some water,True
76920,img/76920.png,0,runway fashion has become much more inclusive and way more creative!,True
86251,img/86251.png,0,i'm not a criminal i'm an undocumented felon,True
76850,img/76850.png,1,would you rather have a gay son or thug son,True
83205,img/83205.png,0,randomly deciding to bake something,True
14268,img/14268.png,0,"you've heard of elf on a shelf, now get ready for",True
29075,img/29075.png,0,he can be his new boy firend,True
84125,img/84125.png,0,when you beat the red light,True
59863,img/59863.png,0,when you find your best goat mating with the neighborhood runt,True
32746,img/32746.png,0,life is like a box of chocolates you never know what you're gonna get,True
92143,img/92143.png,0,when you eat her ass and then she say that she don't suck dick... wayment,True
46215,img/46215.png,0,you think that hoe thinks you're special lol she says that to us too!,True
95821,img/95821.png,1,i don't know how to deal with black people but i guess i'll take a shot at it,True
59623,img/59623.png,1,me trying to tell my her not giving a shit liberal friend how because all men are much i love and trash appreciate her,True
53182,img/53182.png,0,"those who die in blue, are remembered forever",True
61873,img/61873.png,0,cinco de mayo isnt even celebrated by most mexicans it's just an excuse for white americans to get drunk,True
67143,img/67143.png,0,sex is all fun and games until someone has to sleep in the wet spot,True
86253,img/86253.png,0,"think of how stupid the average person is, and realize half of them are stupider than that",True
50942,img/50942.png,0,wayment...way' one gotdamn minute ...'the fuckis dis shit.,True
04152,img/04152.png,0,over 50 south africans lost their lives after police opened fire during a protest,True
46529,img/46529.png,0,look son...another terror attack by peaceful bears!,True
84971,img/84971.png,0,"in my day you were either pro america or you were a commie you can call yourself liberal, progressive or socialist but you're really nothing more than a commie pinko john wayne was never in the military",True
34068,img/34068.png,0,"remember no matter how much you cry like a little bitch, trump will still be your president",True
84521,img/84521.png,1,asians be like switching to fullscreen mode,True
89367,img/89367.png,0,"mr. president, epstein is still alive",True
14870,img/14870.png,0,chimps asking for food,True
28973,img/28973.png,1,worst pijama party ever,True
53694,img/53694.png,1,"they kill gays, and women who go out in public without a male relative and are supported by democrats and liberals",True
07164,img/07164.png,0,i promise i promise. i promise. i deliver,True
51046,img/51046.png,0,shut up you meathead,True
54710,img/54710.png,0,can't snort coke through a rolled-up bitcoin,True
39504,img/39504.png,0,this dude wants to use the same restroom as your daughter liberals call you a bigot if you object,True
16093,img/16093.png,0,when they laugh about your 9cm in the change room but they haven't seen you're 9 mm yet,True
52301,img/52301.png,0,"let me be clear.... if i had a son, he would look like harambe",True
76582,img/76582.png,0,how my friends introduce me she's our friend and she's crazy!,True
20948,img/20948.png,1,"trumpanzees when are you low skilled, white trash motherfuckers gonna get busy doing all the jobs mexicans used to do? we're waiting",True
61495,img/61495.png,0,i'll never forget the time.. your grandad put me on his shoulders so i could show my tits to slayer,True
15076,img/15076.png,0,immigrant problem problem fixed,True
39470,img/39470.png,1,"patriarchy: while the men had fun dying... the females were oppressed.. ..inside ""comfortable concentration camps"" called homes",True
56189,img/56189.png,0,hiroshima 1945 2016 detroit 1945 2016 moral of the story.. it's easier to come back from a nuclear bomb than 5 decades of big gover government policies,True
92183,img/92183.png,0,"ilhan omar told several republicans that they should try shawarma, a delicious middle eastern dish from her culture",True
58129,img/58129.png,0,"me to me: ""he's cute! just don't come on too strong!"" also me:",True
27068,img/27068.png,1,he went to jihad's,True
78610,img/78610.png,1,the difference between moderate muslim and radical muslim follow my allah or he kill follow my allah or i kill you! you moderate muslim radical muslim,True
08251,img/08251.png,1,the name's todd... retodd,True
59621,img/59621.png,1,"lets see if this is considered dark honey,you killed a butterfly. no butter for you for a month dad i also killed a cockroach today. nice try..",True
54927,img/54927.png,1,"if a muslim beats his wife, is it domestic violence, or child abuse",True
81273,img/81273.png,0,sure i shit talk the people i like but i shoot the people i don't like so that has to count for something right?,True
65179,img/65179.png,0,how i see kim burell everytime she grabs a mic,True
57094,img/57094.png,0,my local mosque is really going all out for gay pride this year,True
96325,img/96325.png,1,yesterday i told my wife her soup tasted like crap today it is much better,True
04917,img/04917.png,0,similar to sharks because all the great ones are white,True
90756,img/90756.png,0,obama family photo,True
13428,img/13428.png,1,i've told my neighbor to keep thier pug out of my yard 3 times already,True
26095,img/26095.png,0,when you're going 90 mph in a school zone and the pre-schoolers are crossing the street this is where the fun begins,True
05489,img/05489.png,0,trump says he doesn't like suppressors. well.....he's a democrat so..,True
34768,img/34768.png,0,what a true rapist looks like,True
24783,img/24783.png,1,when you go out to fight for independence but forgot to lock up the slaves,True
04726,img/04726.png,0,islamic state soldiers celebrating we should kill them all,True
25370,img/25370.png,0,porch monkey 4 life,True
65392,img/65392.png,1,kylie's pregnant i'm gonna be a tranpa !,True
27563,img/27563.png,1,when you're so racist you won't even hire white guys to commit fake white hate crimes against yourself!,True
79864,img/79864.png,0,never forget,True
82743,img/82743.png,0,whatever this is... it's an auburn fan,True
46528,img/46528.png,0,if you're happy and you know it go to hell,True
23759,img/23759.png,1,this nigar behind me ain't in compliance,True
26905,img/26905.png,1,thanks trump for my new job making america white again,True
61285,img/61285.png,0,"if evolution is true then why are there still monkeys? if the internet puts the totality of human knowledge at your fingertips, then why are there still idiots?",True
58160,img/58160.png,0,america in reality don't let the media divide us!,True
38790,img/38790.png,0,rabbits jump and they live for 8 years dogs walk and they live for 15 years. turtles do nothing and they live for 150 years. lesson learned,True
65308,img/65308.png,1,"hello, maria? yes your uber has arrived",True
14378,img/14378.png,0,family are gathered in the kitchen the mum is watching her son interact with his sister,True
25416,img/25416.png,0,i haven't been this excited about a friday since last friday,True
46832,img/46832.png,0,man dresses up to celebrate the chinese new year of the pig,True
50438,img/50438.png,1,what it looks like when cancer gets aids,True
16254,img/16254.png,1,define nowfag i want it now!,True
34619,img/34619.png,0,when she finally has your own month,True
65024,img/65024.png,1,i don't always get called a homophobe but when i do the people saying it always look like retards,True
65147,img/65147.png,0,look son a fucking idiot,True
41623,img/41623.png,0,.... if only it gave you legs,True
95763,img/95763.png,1,i was gonna make a muslim joke but they always blow up in your face gotta be careful,True
06345,img/06345.png,0,"driver: ""what am i supposed to do with this speeding ticket?"" .co "" officer: ""keep it, when you collect four of them, you get a bicycle.""",True
63150,img/63150.png,0,my favorite vegetable is me!,True
90247,img/90247.png,1,long time no see nigger,True
68503,img/68503.png,1,when the muslim pulls out a bomb from his bag it's so fucking big,True
13895,img/13895.png,0,it's time for america to flush this turd,True
19503,img/19503.png,0,you're asking people for 5 cents a day? but you had money to fly here and make a commercial?,True
65187,img/65187.png,0,this is the result of letting muslims in,True
04597,img/04597.png,0,terrorist attacks innocent people with guns leaders want innocent people to give up their guns and become even more defenseless.,True
84236,img/84236.png,0,you cant post that,True
81956,img/81956.png,0,sharks don't attack him why? they think it's whale shit,True
76549,img/76549.png,0,mariachis make the party 10x better,True
03981,img/03981.png,0,siri take me home starting route to gym,True
71236,img/71236.png,1,"dark humor is like hitler some people call it wrong, but i find it completely justified",True
14082,img/14082.png,1,face down. ass up. that's the way we like allah,True
83476,img/83476.png,0,my kids will never know that awful feeling of realizing there's no vhs tape behind the box at the video store,True
45179,img/45179.png,0,congratulations it's a boy,True
61380,img/61380.png,0,who you gonna call? ghostbusters,True
19573,img/19573.png,0,when you have a screaming contest at the protest,True
42601,img/42601.png,1,when the squad is about to get lit.,True
84596,img/84596.png,1,isis glory hole,True
36872,img/36872.png,1,for the last time.. i'm not michelle obama,True
24586,img/24586.png,0,laundry day,True
48706,img/48706.png,0,would you help give a push if you were ask,True
25107,img/25107.png,1,"open you hand tyrone, i know you stole it",True
89764,img/89764.png,0,we had a major crisis,True
01823,img/01823.png,0,i too was once a male trapped in a female's body but then i was born,True
50823,img/50823.png,0,if this makes you a citizen does this make him family?,True
08657,img/08657.png,1,i saw her standing there and i told her she had three beautifull children. she did't have to get all pissed off and threaten me. it was an honest mistake,True
94650,img/94650.png,0,happy anniversary to that time you headbutted your way out of a vagina,True
40819,img/40819.png,1,see the difference? negro real jews european fake jews,True
43051,img/43051.png,0,1/1024th native american 1024/1024th your president,True
16340,img/16340.png,0,you call me a goat fucker that is racist,True
38756,img/38756.png,0,when you lose your first boxing match,True
10584,img/10584.png,0,goes on tinder instead of match.com,True
16032,img/16032.png,0,michelle obama sighted sun bathing in afghanistan,True
19205,img/19205.png,0,"hey, i just met you, and this is crazy i forgot the condom, so anal maybe?",True
52748,img/52748.png,0,about to explode l with pride now that his daughter can go to school,True
14523,img/14523.png,0,every modern rap album cover,True
24178,img/24178.png,1,i'm at the camp and i still can't concentrate,True
69307,img/69307.png,1,who needs a human interaction when you've got a loyal animal companion,True
64207,img/64207.png,1,me and the boys after killing innocent people in a bomb blast,True
53187,img/53187.png,0,this moment changed the world,True
08793,img/08793.png,1,that's black people for ya what did you expect,True
29173,img/29173.png,0,"9's on the stock bottom no your ls cant do that! wait, im ls swapped..",True
27950,img/27950.png,0,"yes, this is she",True
86725,img/86725.png,1,designed for maximum concentration,True
36542,img/36542.png,1,911 three white kids in the park planning the next school shooting two can play that game,True
42065,img/42065.png,0,when you tease your husband in public,True
56749,img/56749.png,0,way over there is where you go with that bullshit,True
54370,img/54370.png,0,when you stoned your 3rd wife yesterday and you're lonely ankle compilaion,True
17306,img/17306.png,1,march against muslims 6 million dogs in britain 3 million muslims dogs lives matter we demand muslim free zones i lost my job as a sniffer dog because muslim racists say i'm 'unclean',True
28431,img/28431.png,0,if i become a superhero would i be an ex-men or a trans-former,True
10453,img/10453.png,1,all men are pigs women are equal to men,True
73192,img/73192.png,0,house of god,True
47801,img/47801.png,0,"but then again this is too good, ekse",True
16973,img/16973.png,0,when mom dresses you for picture day,True
69804,img/69804.png,1,thats a little savage,True
24971,img/24971.png,1,thinking about avdol's death remembering he was a muslim,True
34097,img/34097.png,1,etch a sketch for my birthday worst present ever,True
25713,img/25713.png,0,tammy find me them keys,True
73480,img/73480.png,1,just bought my first slow cooker!,True
75269,img/75269.png,0,oh how cute.... a guinea pig.,True
15328,img/15328.png,0,please follow proper safety protocal osha is there for a reason,True
41208,img/41208.png,1,breaking news nation of islam members listen to minister louis farrakhan speech at united center in chicago,True
45802,img/45802.png,0,"a summary of every jewish holiday they tried to kill us, we won, let's eat",True
76824,img/76824.png,0,"feeling cute might eat hay later, idk",True
74298,img/74298.png,0,book about good and bad,True
97501,img/97501.png,0,what women think they'll do when the economy collapses vs what they'll actually do,True
37924,img/37924.png,1,49 people were killed at christ church 49 people were killed at christ church mosques muslim muslim,True
92437,img/92437.png,1,-your pug is cute as hell -that's my son,True
10325,img/10325.png,0,i will build a space force and make the martians pay for it believe me! bigly!,True
96730,img/96730.png,0,all i want for christmas is 6 million,True
43178,img/43178.png,1,middle eastern prostitute,True
21836,img/21836.png,0,if'm yous still 1 teef at 30 y'all don't know how ta live,True
12657,img/12657.png,1,hans ja? get him to auschwitz,True
69380,img/69380.png,1,adding coolant when the farm equipment overheats,True
24650,img/24650.png,0,eat have more more bacon sex?,True
46701,img/46701.png,0,"watching news always confuses me, immigration, tax, government!!",True
97103,img/97103.png,0,when the human asks who knocked everything off the table awiens,True
29476,img/29476.png,1,"""america has stolen the jews the jews of god his jewelry the negroes they are the true hebrews"" google it",True
43816,img/43816.png,0,"admit it, you sometimes listen to strangers conversations and think to yourself, ""you are a stupid motherfucker""",True
62149,img/62149.png,0,boy with progeria disease and his pet cat,True
84327,img/84327.png,1,when you're losing an argument against your black friend,True
13476,img/13476.png,0,i keep hitting the escape key... but i'm still here,True
35064,img/35064.png,0,thats a makeup artist for you. what did you expect?,True
45810,img/45810.png,1,ladies! if your man is offended by this he is a faggot end of story,True
86257,img/86257.png,0,we're glad you're home the russians pooped in the hallway!,True
57849,img/57849.png,0,"honor killings are part of our culture well then, it will be my honor to kill you all",True
73421,img/73421.png,0,what if he was the second coming of christ certainly would explain his issue with jewish people,True
86325,img/86325.png,0,nothing beats a cut of coffee in the morning,True
96230,img/96230.png,0,it was gonna jump! i'm holdin' it back!,True
60439,img/60439.png,0,over 620 000 white people died to free black slaves so please lets cut the bullshit out - jf16,True
98751,img/98751.png,0,"""the other day i was sucking my sister and she said ""you fuck like dad"" and i was like ""that's what mom said""",True
05362,img/05362.png,0,you like something that i do not particularly enjoy disgusting prepare to forfeit your life,True
08297,img/08297.png,0,ahmed? i'm pregnant!!,True
89504,img/89504.png,1,retarded all stars retarded team of the week,True
85930,img/85930.png,1,silence female retard,True
36025,img/36025.png,0,then they gave me a crown of thorns and whipped me it was so hot i came twice,True
83504,img/83504.png,1,look son... another terror attack by peaceful muslims!,True
58706,img/58706.png,1,when you're so high you make down syndrome up syndrome,True
86751,img/86751.png,0,and just like that.. i'm into hiking,True
50237,img/50237.png,1,cannibalism,True
46953,img/46953.png,0,bruce jenner's cat,True
17238,img/17238.png,0,refugees welcome,True
60213,img/60213.png,1,then he said i couldn't come to the barbecue because i always burn the franks,True
23159,img/23159.png,0,"don't be rude, folks go to their page and wish them a happy easter",True
80537,img/80537.png,1,uncle daddy and me gonna have us a nephson,True
71630,img/71630.png,0,my tits may be nice but my pussy is the bomb,True
43218,img/43218.png,0,do you think a terrorist has or could infiltrate our goverment ???,True
78429,img/78429.png,0,life is hard it's harder when you're stupid,True
50462,img/50462.png,0,can you see the difference?,True
70932,img/70932.png,1,when your dishwasher is broken so you take it back to walmart to get a new one,True
67802,img/67802.png,0,america sucks. conservatives are racists. rich people are evil. give me your money. the 2020 democrats!,True
29013,img/29013.png,0,meanwhile at the isis strip club,True
96120,img/96120.png,0,"dude! look at this girl! carl, shut the... damn that ass!",True
18045,img/18045.png,1,"carolina squat what kind of mental midget, coconut humping, poop throwing from a tree, goat herding, mouth breathing, have you seen my helmet moron remotely thought this was cool",True
30192,img/30192.png,1,when tr*nnies want to be accepted but they mutilate their bodies,True
48705,img/48705.png,1,"yeah, i'm lgbt let god burn them",True
75618,img/75618.png,0,i am nurtured by your hatred,True
57631,img/57631.png,1,adding coolant when the farm equipment overheats,True
51209,img/51209.png,0,just for control ne this is my current mood,True
45182,img/45182.png,1,for just ten cents a day you can have delicious hand jerky,True
40758,img/40758.png,1,faceswap ching chong 100,True
96810,img/96810.png,0,30 minutes after eating taco bell,True
92140,img/92140.png,1,when you have a small dick and tell a jewish girl to suck it. i can't,True
80195,img/80195.png,1,how do you know if a black guy is well hung? you can't fit your finger between the rope and it's neck!!,True
65708,img/65708.png,0,i won a gift card for blockbuster,True
19203,img/19203.png,0,remember when they voted on your new green deal in the senate and no one supported it? that was awesome!,True
43095,img/43095.png,0,"look at these precious 3- year olds & windows, said no sane person, ever",True
48715,img/48715.png,0,shut up cunt.,True
61379,img/61379.png,0,that face you make when you're a bully and just got beat up by a girl,True
92385,img/92385.png,0,you can fuck off with that shit you can fuck straight off to fuck off mountain while riding your fuck horse to the land of awwww hell no,True
03629,img/03629.png,0,hey man you gotta go home my parents are fighting again,True
46173,img/46173.png,0,blowjobs buy one get one free,True
57346,img/57346.png,0,"whlle the keepers were distracted, harold, the oldest of all the apes, made his escape by posing as a wheelbarrow wheelbarrow pusher",True
54670,img/54670.png,1,knowing white people he's probably the father,True
45281,img/45281.png,1,no woman commits suicide of they fail to find broke guy for marriage,True
09162,img/09162.png,0,please make them white,True
43519,img/43519.png,0,muslims in a predominantly christian nation christians in a predominantly muslim nation,True
31748,img/31748.png,1,ramadan begins may 27. bombathon ends june 24,True
50764,img/50764.png,1,mooch in his natural habit,True
63720,img/63720.png,0,i dont like sandwiches . oh well nevermind ..,True
38590,img/38590.png,1,new zealand edition call of duty,True
90186,img/90186.png,0,white trash you are doing it right,True
69125,img/69125.png,1,police academy graduation ceremony,True
72951,img/72951.png,0,october 31: this year i'm gonna get through no nut november november 1: so that was a fucking lie,True
21605,img/21605.png,1,jokes don't kill people muslims who are offended by jokes kill people,True
91574,img/91574.png,0,"i don't like the term ""rape"" i prefer ""cuddle with a struggle""",True
08621,img/08621.png,0,"thats fucked up, but i like it",True
90285,img/90285.png,0,when your friend looks at you after the acid drops,True
20791,img/20791.png,0,"islam ""i will instill terror into the hearts of the un believers: smite ye above their necks and smite all their finger-tips off."" quran 8:12",True
17439,img/17439.png,0,when you stuff your jewish chicken before you give it a good roast,True
85172,img/85172.png,1,that look when your father sells you for a goat,True
46217,img/46217.png,1,"hey barack, my tranny is better than yours!",True
63452,img/63452.png,1,this is nahir nahir is born in germany nahir is german this is fluffy fluffy is born in horse stable fluffy is a horse,True
75816,img/75816.png,0,fresh out of fb jail and still not giving a fuck!,True
79182,img/79182.png,1,i told my gay friend that i can turn fruits into vegetables and he told me to prove it so i pushed him off a balcony,True
91372,img/91372.png,1,when you're muslim but you have oil,True
93615,img/93615.png,0,i hate when i see a black out in my neighborhood but i still offer my neighbors a candle,True
61208,img/61208.png,0,im not racist i love all my friends,True
85714,img/85714.png,0,when you're friends make fun of you for having a weird shaped body,True
97361,img/97361.png,1,how do mexicans feel about trumps wall? they'll get over it,True
37615,img/37615.png,1,i thought of something funnier than 9/11 the holocaust,True
40265,img/40265.png,0,"excuse me, do you have a moment to talk about racism?",True
54062,img/54062.png,0,danish bacon ... it's gonna rock your world,True
13607,img/13607.png,0,respect your elders they've learned a lot in their time,True
35189,img/35189.png,0,when you don't abort the baby and it dies anyways,True
46302,img/46302.png,0,when you escape a heatwave a sprinkler,True
73620,img/73620.png,0,"if one drop of semen contains more life than a drop of blood, then why don't vampires suck cock? oh wait......twilight",True
34596,img/34596.png,1,i like my coffe like i like my slaves extra dark,True
94578,img/94578.png,0,that face she makes when ahmed hits the g-spot,True
35890,img/35890.png,0,"a vaginai is like a tin roof if you don't nail it enough, it ends up over at the neighbors",True
83701,img/83701.png,0,will you hurry up and die you chocolatey little fucker i'm fucking starving,True
21604,img/21604.png,0,bruce jenner's cat,True
63057,img/63057.png,1,smh kids these days rely too much on technology,True
08357,img/08357.png,0,nazi soldiers used flame throwers to clear trenches,True
68329,img/68329.png,0,i just hear my girlfriend is pregnant,True
06378,img/06378.png,1,let's end racism,True
86974,img/86974.png,0,proud to exercise my beliefs,True
83059,img/83059.png,0,"a ""man bun?"" i tie my hair like that giving head",True
62705,img/62705.png,1,do you want to know the real reason they don't want 5.7 million muslims rioting in their streets the french government hasn't mentioned terrorism?,True
42073,img/42073.png,1,destroy diversity. preserve the uniqueness of white culture,True
85173,img/85173.png,0,meanwhile at the isis strip club,True
84790,img/84790.png,0,the first president they can't control ...and they don't likeit!,True
85476,img/85476.png,0,sometimes a man's purpose in a woman's life is to help her become a better woman... for another man,True
65804,img/65804.png,1,"""so i'm expected to walk on eggshells in my own country just so i don't offend some 7th century islamic goat humpers who ain't figured out yet this is the 21st century???"" ""what the hell kinda meat headed bullshittery do you call that?!??""",True
76510,img/76510.png,0,"chelsea clinton... so ugly that when she gives head, it counts as anal",True
82756,img/82756.png,1,destroying babri hindu niqqas after buslims after throwing stones on local mandir,True
93764,img/93764.png,0,"dude, sometimes when i close my eyes i can't see",True
73581,img/73581.png,1,we are the knights who say nigger,True
58217,img/58217.png,0,dudes be like i'm just going to like all of her pics... except for the ones of her and her man,True
83765,img/83765.png,0,so....i guess you can't give me an old fashioned... ....how bout a bj?,True
13856,img/13856.png,0,officer down,True
24083,img/24083.png,1,i don't see a poblem with banging my sister adam and eves kids had to bang to populate the world,True
98047,img/98047.png,0,never trust women,True
06537,img/06537.png,0,lust and love,True
70628,img/70628.png,0,it's a piece of cake if she's not awake,True
95467,img/95467.png,1,how! can i get dat percap?,True
90864,img/90864.png,0,rice cooker now versus in 1945,True
26153,img/26153.png,1,"when your ex says ""you won't find a b*tch half the woman i am""",True
48512,img/48512.png,0,mississippi wind chime,True
71568,img/71568.png,0,raising goats is hard work,True
48639,img/48639.png,0,disney and chill ?,True
92085,img/92085.png,0,creeps into your childs room empties his sack,True
74362,img/74362.png,0,when someone asks me to remove a picture because they're offended,True
59178,img/59178.png,0,did nazi that coming,True
27915,img/27915.png,0,classic photo of anne frank,True
67283,img/67283.png,0,i'm trying to put a load in the dishwasher him: let me help you!,True
03728,img/03728.png,0,"stalin: if you invade us, you break our agreement hitler: quicksaving..",True
17894,img/17894.png,0,"i vote republican... ...because i may not have much, but republicans will make sure others have even less",True
12876,img/12876.png,0,fucking aye,True
